{
    "type": "NetworkRoutes",
    "protocol": "PROTOCOL-NAME",
    "version": "PROTOCOL-VERSION",
    "metric": "PROTOCOL-METRIC",
    "router_id": "ROUTER-ID",
    "routes": [
        {
            "destination": "ID",
            "source": "ID",
            "next" : "ID",
            "device": "DEVICE",
            "cost": 1
        }
    ]
}
